{
  "id": "Q11356025",
  "checked_at": "2026-10-16T22:30:00+09:00",
  "check_mode": "light",
  "operating_status": "operating",
  "status_note": null,
  "official_url": "https://www.city.otsu.lg.jp/soshiki/010/1126/index.html",
  "address": "〒520-0035 大津市小関町1-1",
  "source_urls": [
    "https://www.city.otsu.lg.jp/soshiki/010/1126/s_1/24910.html",
    "http://www.city.otsu.lg.jp/soshiki/010/1126/index.html"
  ],
  "regular_hours": [
    {
      "days": [
        "mon",
        "tue",
        "wed",
        "thu",
        "fri",
        "sat",
        "sun",
        "holiday"
      ],
      "open": "09:00",
      "close": "17:00",
      "last_entry": "16:30"
    }
  ],
  "closed_weekdays": [
    "mon"
  ],
  "holiday_rule": "open_next_weekday_closed",
  "special_closures": [
    {
      "from": "2026-11-04",
      "to": "2026-11-04",
      "reason": "祝日の翌日"
    },
    {
      "from": "2026-12-27",
      "to": "2027-01-05",
      "reason": "年末年始"
    }
  ],
  "special_openings": [],
  "exhibitions": [
    {
      "title": "節子の遊び心がひそむ小さな森 ―ひっそりとたたずむ生き物たち―",
      "start": "2026-07-14",
      "end": "2026-11-01",
      "url": "https://www.city.otsu.lg.jp/soshiki/010/1126/e/66374.html",
      "kind": "special",
      "summary": "作品の片隅にそっと描かれた小さな生き物を探しながら、三橋節子の遊び心と静かなメッセージを感じる企画展",
      "recommend": "背景の木陰や人物の足元に忍び込む小さな生き物たちに気づいたとき、画家の遊び心が伝わる。目をこらして探すひとときも作品鑑賞の楽しさのひとつ。",
      "admission": "一般 330円",
      "adult_price": 330
    },
    {
      "title": "三橋節子が描く色彩の世界",
      "start": "2026-11-03",
      "end": "2027-02-28",
      "url": "https://www.city.otsu.lg.jp/soshiki/010/1126/e/65320.html",
      "kind": "special",
      "summary": "野草・人間・物語のモチーフと色彩で3つの世界に分けて三橋節子の絵を紹介",
      "recommend": "35年の短い生涯で描いた野草、人間、物語の作品を、モチーフと色彩で三つの世界に分けて展示。それぞれの空間で、絵に込められた思いを感じ取れる構成になっている。",
      "admission": "一般 330円",
      "adult_price": 330
    },
    {
      "title": "第16回 叡風会能面展",
      "start": "2026-10-23",
      "end": "2026-10-25",
      "url": "https://www.city.otsu.lg.jp/soshiki/010/1126/e/76733.html",
      "kind": "other",
      "summary": "長等創作展示館での能面展",
      "recommend": null,
      "admission": null,
      "adult_price": null
    }
  ],
  "adult_price": 330,
  "free_days": [
    {
      "from": "2026-11-14",
      "to": "2026-11-15",
      "scope": "collection",
      "reason": "関西文化の日",
      "source_url": "https://www.the-kansai-guide.com/ja/kansaibunkanohi/"
    }
  ],
  "free_rules": [],
  "access": [
    {
      "station": "上栄町",
      "lines": "京阪京津線",
      "exit": null,
      "walk_min": 10
    },
    {
      "station": "大津",
      "lines": "JR琵琶湖線",
      "exit": null,
      "walk_min": 20
    }
  ],
  "highlights": "35歳の若さで逝った長等ゆかりの画家・三橋節子の作品を専門に収蔵・展示する美術館。野草や小さな生き物を丹念に描いた作品、インド人物画、近江昔話を題材にした情感あふれる絵が揃う。作品の片隅に忍ばせた遊び心も含め、短い生涯に凝縮された世界を堪能できる。",
  "closed_between_exhibitions": false,
  "notes": "休館日は月曜（祝日の場合は翌日）・祝日の翌日（日曜は開館）・12/27〜1/5。11/4 は文化の日の翌日として休館に入れた。企画展の題名は読めたページに無く、会期のみ。無料駐車場約10台。観覧料は一般330円・大学高校生240円・中小学生160円・市内65歳以上160円。",
  "confidence": "medium"
}
