{
  "id": "Q11595533",
  "checked_at": "2026-10-10T11:30:00+09:00",
  "check_mode": "full",
  "operating_status": "unknown",
  "status_note": null,
  "official_url": "https://www.town.saitama-miyoshi.lg.jp/",
  "address": null,
  "source_urls": [
    "https://www.town.saitama-miyoshi.lg.jp/kanko/rekishi/kyuShimadake.html",
    "https://www.town.saitama-miyoshi.lg.jp/study/shakai/rekishi_minzoku.html"
  ],
  "regular_hours": [],
  "closed_weekdays": [],
  "closed_nth_weekdays": [],
  "holiday_rule": "unknown",
  "special_closures": [],
  "special_openings": [],
  "exhibitions": [],
  "adult_price": null,
  "free_days": [],
  "free_rules": [],
  "access": [],
  "highlights": null,
  "closed_between_exhibitions": false,
  "notes": "2026年10月再挑戦調査。「三芳町立上富小学校旧敷地」は独立した博物館施設として存在しないことを改めて確認。Wikidata Q11595533はWikidata上では「秋田県総合公社」と紐付いており、データ整合性に疑義あり。三芳町公式サイト（rekishi）には旧島田家住宅・歴史民俗資料館・三富新田の情報はあるが上富小学校旧敷地の施設情報はなし。上富小学校は令和10年度（2028年度）目途に三芳小学校に統合予定（三芳町学校再編等審議会答申）。跡地には「（仮称）にほんの里100選 三富未来交流センター」の整備が2025年基本方針として策定されているが、開館時期・施設詳細は未定。近隣施設: 旧島田家住宅（埼玉県入間郡三芳町上富1279-3、無料、9:00〜16:00、月曜・祝日・年末年始休館）、三芳町立歴史民俗資料館（同町大字竹間沢877、無料、9:00〜16:30入館16:00まで、月曜・祝日・年末年始休館・みずほ台駅徒歩25分またはMIYOバス）。現時点では独立した博物館機能なし。",
  "confidence": "low"
}
