{
  "id": "Q11478412",
  "checked_at": "2026-10-10T10:05:00+09:00",
  "check_mode": "full",
  "operating_status": "temporarily_closed",
  "status_note": "2019年の台風被災により等々力緑地の旧施設は閉鎖。市内の他施設やオンラインでアウトリーチ形式の展覧会等を実施中。新たなミュージアムは計画段階で開館時期は未公表。",
  "official_url": "https://www.kawasaki-museum.jp/",
  "address": "〒215-0021 川崎市麻生区上麻生6丁目15番2号",
  "source_urls": [
    "https://www.kawasaki-museum.jp/",
    "https://www.kawasaki-museum.jp/exhibition/34490/",
    "https://www.kawasaki-museum.jp/exhibition/34739/"
  ],
  "regular_hours": [],
  "closed_weekdays": [],
  "holiday_rule": "unknown",
  "special_closures": [],
  "special_openings": [],
  "exhibitions": [
    {
      "title": "オンライン展覧会「和から洋へ ー女性たちはどう着替えたかー」",
      "start": "2026-10-09",
      "end": "2027-03-31",
      "url": "https://www.kawasaki-museum.jp/exhibition/34490/",
      "kind": "other",
      "summary": "オンライン開催。明治から戦後にかけて女性が和装から洋装へ着替えていった過程を収蔵品で紹介",
      "admission": "無料"
    },
    {
      "title": "ベル・エポックの煌めき　光が紡いだ夢のあとさき",
      "start": "2026-11-07",
      "end": "2026-12-20",
      "url": "https://www.kawasaki-museum.jp/exhibition/34739/",
      "kind": "other",
      "summary": "向ヶ丘遊園中和ビル2階で開催。19世紀のアール・ヌーヴォーとベル・エポックの美意識を収蔵品で紹介",
      "recommend": "産業革命と技術革新が生んだ「美しき時代」ベル・エポックを、川崎市民ミュージアム所蔵作品でたどる無料展。アール・ヌーヴォーの装飾美から都市文化の光と影まで、夢の軌跡を楽しめる。",
      "admission": "無料",
      "adult_price": 0,
      "closed_weekdays": ["mon"],
      "closed_dates": ["2026-11-24"]
    },
    {
      "title": "第60回かわさき市美術展",
      "start": "2027-02-26",
      "end": "2027-03-13",
      "url": "https://www.kawasaki-museum.jp/exhibition/34275/",
      "kind": "other",
      "summary": "公募展の入選・入賞作品展。アートガーデンかわさき展示室（川崎駅前タワー・リバーク3F）で開催",
      "recommend": null,
      "admission": "無料",
      "adult_price": 0,
      "closed_dates": [
        "2027-03-01",
        "2027-03-08"
      ]
    }
  ],
  "closed_between_exhibitions": false,
  "notes": "事務所の連絡先は 〒215-0021 川崎市麻生区上麻生6丁目15番2号（施設所在地ではない）。展覧会はオンライン（「the 3rd Area of \"C\"」）で実施。 開館時間・観覧料・最寄駅は公式サイトに記載なし（施設閉鎖中）。第60回かわさき市美術展の会場は川崎市幸区大宮町1310（最終日3/13は13:00まで）。",
  "confidence": "high"
}
