{
  "id": "Q48747268",
  "checked_at": "2026-10-30T06:26:28+09:00",
  "check_mode": "full",
  "operating_status": "operating",
  "status_note": null,
  "official_url": "https://www.town.godo.gifu.jp/event/event23.html",
  "address": "岐阜県安八郡神戸町大字神戸1220番地の1",
  "source_urls": [
    "https://www.town.godo.gifu.jp/event/event23.html",
    "https://www.town.godo.gifu.jp/event/pdf/event23_autumn.pdf"
  ],
  "regular_hours": [
    {
      "days": [
        "mon",
        "tue",
        "wed",
        "thu",
        "fri",
        "sat",
        "sun",
        "holiday"
      ],
      "open": "09:00",
      "close": "16:00",
      "last_entry": "15:30"
    }
  ],
  "closed_weekdays": [
    "tue"
  ],
  "holiday_rule": "open_next_weekday_closed",
  "special_closures": [],
  "special_openings": [],
  "exhibitions": [
    {
      "title": "令和8年度 秋季展",
      "start": "2026-10-31",
      "end": "2026-11-30",
      "url": "https://www.town.godo.gifu.jp/event/pdf/event23_autumn.pdf",
      "kind": "special",
      "summary": "日比野五鳳・日比野光鳳の書作品を展示",
      "recommend": "現代仮名書壇の最高位とされた日比野五鳳の代表作を所蔵する館が、年2回だけ開く秋の展観。五鳳と日比野光鳳の書に、会期限定でじかに触れられる。",
      "admission": "一般・大学生220円",
      "adult_price": 220,
      "closed_dates": [
        "2026-11-04"
      ]
    }
  ],
  "adult_price": 220,
  "free_days": [
    {
      "from": "2026-11-03",
      "to": "2026-11-03",
      "scope": "all",
      "reason": "文化の日（観覧無料）",
      "source_url": "https://www.town.godo.gifu.jp/event/pdf/event23_autumn.pdf"
    }
  ],
  "free_rules": [],
  "access": [
    {
      "station": "広神戸",
      "lines": "養老鉄道養老線",
      "walk_min": 15
    }
  ],
  "highlights": "書道家・日比野五鳳の遺品と作品を展示する記念美術館。岐阜県安八郡神戸町の公民館に併設し、春（4月下旬〜5月下旬）と秋（10月下旬〜11月下旬）の年2回の企画展期間のみ開館する。五鳳は毎日書道会の創設にも関わった昭和の代表的書道家。",
  "closed_between_exhibitions": true,
  "notes": "春季展・秋季展の会期中のみ開館（会期外は閉館）。毎週火曜定休、祝日は開館し翌平日休館。入館料は一般・大学生220円、高校生以下・障がい者手帳所持者無料。文化の日（11/3）は観覧無料。秋季展2026（10/31〜11/30）はPDF公式案内で確認。11/3（火・祝）は開館し11/4（水）代替休館。",
  "confidence": "high"
}