{
  "id": "wp-3e00452c",
  "checked_at": "2026-10-10T15:58:06+09:00",
  "check_mode": "full",
  "operating_status": "operating",
  "status_note": null,
  "official_url": "https://tenplaza.info/",
  "address": "〒700-0814 岡山県岡山市北区天神町8-54",
  "source_urls": [
    "https://www.pref.okayama.jp/site/art/655863.html",
    "https://www.okayama-kanko.jp/spot/detail_10214.html"
  ],
  "regular_hours": [
    {
      "days": ["mon", "tue", "wed", "thu", "fri", "sat", "sun", "holiday"],
      "open": "09:00",
      "close": "18:00"
    }
  ],
  "closed_weekdays": ["mon"],
  "holiday_rule": "unknown",
  "special_closures": [
    {
      "from": "2026-12-28",
      "to": "2027-01-03",
      "reason": "年末年始休館"
    }
  ],
  "special_openings": [],
  "exhibitions": [],
  "adult_price": null,
  "free_days": [],
  "free_rules": [],
  "access": [
    {
      "station": "岡山",
      "lines": null,
      "exit": "東口",
      "walk_min": null,
      "note": "岡山駅東口から路線バスまたは岡山電気軌道「城下」電停下車、徒歩約10分"
    }
  ],
  "highlights": "1962年に前川國男が設計した赤煉瓦の建築で、岡山市の芸術文化活動の拠点。5つの展示室・270席のホール・練習室・会議室・文化情報センターを備え、岡山ゆかりの作家を紹介する自主企画展「天プラ・セレクション」を定期的に開催。美術展の図録を自由に閲覧できる文化情報センターも来館者に開放している。",
  "closed_between_exhibitions": false,
  "notes": "旧称・岡山県総合文化センター（1962年開館）。主に貸しホール・貸し展示室として運営する文化施設で、常設コレクションはない。自主企画「天プラ・セレクション」（岡山ゆかりの作家の個展形式）のほか、各種公募展・団体展も開催。展示内容は公式サイト（tenplaza.info）に掲載されているがJSレンダリングのため確認不可。開館時間は文化情報センター受付窓口の時間（催し物ごとに異なる場合あり）。月曜休館・年末年始休館（12/28〜1/3）は岡山県・岡山観光ナビページで確認。月曜＋祝日の扱いは未確認。",
  "confidence": "medium"
}
